{
  "version": "2",
  "name": "factory-quality",
  "entry": "measure",
  "nodes": [
    {
      "id": "measure",
      "executor": "quality-measure",
      "input": {
        "sample": "{{ inputs.sample }}"
      },
      "inputSchema": {
        "type": "object",
        "properties": {
          "sample": {
            "type": "string"
          }
        },
        "required": [
          "sample"
        ],
        "additionalProperties": false
      },
      "outputSchema": {
        "type": "object",
        "properties": {
          "score": {
            "type": "number"
          },
          "defects": {
            "type": "array",
            "items": {
              "type": "string"
            }
          },
          "urgent": {
            "type": "boolean"
          }
        },
        "required": [
          "score",
          "defects",
          "urgent"
        ],
        "additionalProperties": false
      },
      "timeoutMs": 30000,
      "retry": {
        "maxAttempts": 1
      }
    },
    {
      "id": "accept",
      "executor": "quality-finish",
      "input": {
        "branch": "accept",
        "score": "{{ nodes.measure.result.score }}",
        "defects": "{{ nodes.measure.result.defects }}",
        "urgent": "{{ nodes.measure.result.urgent }}"
      },
      "inputSchema": {
        "type": "object",
        "properties": {
          "score": {
            "type": "number"
          },
          "defects": {
            "type": "array",
            "items": {
              "type": "string"
            }
          },
          "urgent": {
            "type": "boolean"
          },
          "branch": {
            "type": "string",
            "enum": [
              "accept"
            ]
          }
        },
        "required": [
          "score",
          "defects",
          "urgent",
          "branch"
        ],
        "additionalProperties": false
      },
      "outputSchema": {
        "type": "object",
        "properties": {
          "score": {
            "type": "number"
          },
          "defects": {
            "type": "array",
            "items": {
              "type": "string"
            }
          },
          "urgent": {
            "type": "boolean"
          },
          "branch": {
            "type": "string",
            "enum": [
              "accept"
            ]
          }
        },
        "required": [
          "score",
          "defects",
          "urgent",
          "branch"
        ],
        "additionalProperties": false
      },
      "timeoutMs": 30000,
      "retry": {
        "maxAttempts": 1
      }
    },
    {
      "id": "recheck",
      "executor": "quality-finish",
      "input": {
        "branch": "recheck",
        "score": "{{ nodes.measure.result.score }}",
        "defects": "{{ nodes.measure.result.defects }}",
        "urgent": "{{ nodes.measure.result.urgent }}"
      },
      "inputSchema": {
        "type": "object",
        "properties": {
          "score": {
            "type": "number"
          },
          "defects": {
            "type": "array",
            "items": {
              "type": "string"
            }
          },
          "urgent": {
            "type": "boolean"
          },
          "branch": {
            "type": "string",
            "enum": [
              "recheck"
            ]
          }
        },
        "required": [
          "score",
          "defects",
          "urgent",
          "branch"
        ],
        "additionalProperties": false
      },
      "outputSchema": {
        "type": "object",
        "properties": {
          "score": {
            "type": "number"
          },
          "defects": {
            "type": "array",
            "items": {
              "type": "string"
            }
          },
          "urgent": {
            "type": "boolean"
          },
          "branch": {
            "type": "string",
            "enum": [
              "recheck"
            ]
          }
        },
        "required": [
          "score",
          "defects",
          "urgent",
          "branch"
        ],
        "additionalProperties": false
      },
      "timeoutMs": 30000,
      "retry": {
        "maxAttempts": 1
      }
    }
  ],
  "edges": [
    {
      "from": "measure",
      "to": "accept",
      "when": "nodes.measure.result.score > 80 && len(nodes.measure.result.defects) == 0"
    },
    {
      "from": "measure",
      "to": "recheck",
      "when": "nodes.measure.result.urgent == true || nodes.measure.result.score >= 50"
    },
    {
      "from": "measure",
      "to": "$end"
    },
    {
      "from": "accept",
      "to": "$end"
    },
    {
      "from": "recheck",
      "to": "$end"
    }
  ],
  "inputs": {
    "sample": {
      "type": "string",
      "required": true
    }
  }
}
